{
  "dataset_status": "Pre-publication candidate / internal review — not final public benchmark",
  "version": "v1.0-CORRECTED-4F-REV2",
  "total_records": 160,
  "external_records": 159,
  "unique_external_institutions": 155,
  "group_counts": {
    "A": 25,
    "B": 25,
    "C": 25,
    "D": 25,
    "G": 25,
    "H": 29,
    "I": 5,
    "R": 1
  },
  "disclaimers": [
    "Not a final public benchmark",
    "Source verification pending",
    "URL restoration does not equal source verification",
    "Not an accreditation list",
    "Not an official recognition list",
    "Not a fully verified institutional ranking"
  ],
  "note": "Records A005, A010, B008 are reported cooperation-model / affiliated-branch observations, not verified independent institutional entities. C022/H027 (ICC) and G002/G022 (IAEA) each appear in two dataset contexts by design.",
  "institutions": [
    {
      "id": "A001",
      "name": "The Protocol School of Washington",
      "country": "United States",
      "continent": "North America",
      "group": "A",
      "type": "Private protocol training institution",
      "relevance": "A",
      "established": "1988",
      "verification": "Verification pending",
      "has_website": true,
      "notes": "Leading private protocol training institution. Accredited by ACCET."
    },
    {
      "id": "A002",
      "name": "International School of Protocol and Diplomacy (ISPD)",
      "country": "Belgium",
      "continent": "Europe",
      "group": "A",
      "type": "Private protocol and diplomacy school",
      "relevance": "A",
      "established": "2008",
      "verification": "Verification pending",
      "has_website": true,
      "notes": "Brussels-based. Part of ISPD Group. Executive Master Programme in Protocol & Soft Diplomacy Skills."
    },
    {
      "id": "A003",
      "name": "Diplomatic School of Spain",
      "country": "Spain",
      "continent": "Europe",
      "group": "A",
      "type": "Government diplomatic academy",
      "relevance": "A",
      "established": "1942",
      "verification": "Verification pending",
      "has_website": true,
      "notes": "Attached to Spanish Ministry of Foreign Affairs. Paseo Juan XXIII, 5, Madrid."
    },
    {
      "id": "A004",
      "name": "Instituto del Servicio Exterior de la Nación (ISEN)",
      "country": "Argentina",
      "continent": "South America",
      "group": "A",
      "type": "Government diplomatic academy",
      "relevance": "A",
      "established": "1963",
      "verification": "Verification pending",
      "has_website": true,
      "notes": "Argentine diplomatic training institute."
    },
    {
      "id": "A005",
      "name": "Protocol School of Washington / INAAR Saudi Arabia",
      "country": "Saudi Arabia",
      "continent": "Asia",
      "group": "A",
      "type": "Reported cooperation model",
      "relevance": "A",
      "established": "—",
      "verification": "Verification pending",
      "has_website": false,
      "notes": "Methodological observation only. Reported cooperation model between PSOW and INAAR Saudi Arabia. Not verified institutional entity."
    },
    {
      "id": "A006",
      "name": "National School of Government and International Relations (ENGRI)",
      "country": "Mexico",
      "continent": "North America",
      "group": "A",
      "type": "Government diplomatic academy",
      "relevance": "A",
      "established": "—",
      "verification": "Verification pending",
      "has_website": true,
      "notes": "Mexican diplomatic and international relations training."
    },
    {
      "id": "A007",
      "name": "Foreign Service Institute (FSI)",
      "country": "United States",
      "continent": "North America",
      "group": "A",
      "type": "Government diplomatic training institute",
      "relevance": "A",
      "established": "1947",
      "verification": "Verification pending",
      "has_website": true,
      "notes": "U.S. Department of State training arm. Arlington, Virginia."
    },
    {
      "id": "A008",
      "name": "École Nationale d'Administration (ENA)",
      "country": "France",
      "continent": "Europe",
      "group": "A",
      "type": "Government administrative and diplomatic academy",
      "relevance": "A",
      "established": "1945",
      "verification": "Verification pending",
      "has_website": true,
      "notes": "Now INSP (Institut national du service public). Strasbourg."
    },
    {
      "id": "A009",
      "name": "Diplomatic Academy of Vienna",
      "country": "Austria",
      "continent": "Europe",
      "group": "A",
      "type": "Government diplomatic academy",
      "relevance": "A",
      "established": "1964",
      "verification": "Verification pending",
      "has_website": true,
      "notes": "Favoritenstraße 15a, 1040 Vienna."
    },
    {
      "id": "A010",
      "name": "Protocol Academy of Kosovo — reported affiliated branch / historical branded training presence",
      "country": "Kosovo / North Macedonia",
      "continent": "Europe",
      "group": "A",
      "type": "Reported affiliated branch / historical branded training presence",
      "relevance": "B",
      "established": "—",
      "verification": "Verification pending",
      "has_website": false,
      "notes": "Reported / archived / historical branded presence. Not verified independent current official protocol academy in Kosovo. Linked to Protocol Academy of Macedonia / Skopje context. Verification pending."
    },
    {
      "id": "A011",
      "name": "Georgetown University — School of Foreign Service",
      "country": "United States",
      "continent": "North America",
      "group": "A",
      "type": "University school of foreign service",
      "relevance": "A",
      "established": "1919",
      "verification": "Verification pending",
      "has_website": true,
      "notes": "Washington, D.C."
    },
    {
      "id": "A012",
      "name": "London School of Economics — Diplomacy and International Strategy",
      "country": "United Kingdom",
      "continent": "Europe",
      "group": "A",
      "type": "University programme",
      "relevance": "A",
      "established": "—",
      "verification": "Verification pending",
      "has_website": true,
      "notes": "LSE IDEAS and related diplomacy programmes."
    },
    {
      "id": "A013",
      "name": "China Foreign Affairs University",
      "country": "China",
      "continent": "Asia",
      "group": "A",
      "type": "Government diplomatic university",
      "relevance": "A",
      "established": "1955",
      "verification": "Verification pending",
      "has_website": true,
      "notes": "Beijing. Under Ministry of Foreign Affairs of China."
    },
    {
      "id": "A014",
      "name": "Diplomatic Academy of the Ministry of Foreign Affairs of Russia",
      "country": "Russia",
      "continent": "Europe",
      "group": "A",
      "type": "Government diplomatic academy",
      "relevance": "A",
      "established": "1934",
      "verification": "Verification pending",
      "has_website": true,
      "notes": "Moscow."
    },
    {
      "id": "A015",
      "name": "Indian Foreign Service Institute",
      "country": "India",
      "continent": "Asia",
      "group": "A",
      "type": "Government diplomatic training institute",
      "relevance": "A",
      "established": "1986",
      "verification": "Verification pending",
      "has_website": true,
      "notes": "New Delhi."
    },
    {
      "id": "A016",
      "name": "Japan National Institute for Defense Studies",
      "country": "Japan",
      "continent": "Asia",
      "group": "A",
      "type": "Government defense and strategic studies institute",
      "relevance": "A",
      "established": "1952",
      "verification": "Verification pending",
      "has_website": true,
      "notes": "Tokyo."
    },
    {
      "id": "A017",
      "name": "Australian National University — Crawford School of Public Policy",
      "country": "Australia",
      "continent": "Oceania",
      "group": "A",
      "type": "University school",
      "relevance": "A",
      "established": "—",
      "verification": "Verification pending",
      "has_website": true,
      "notes": "Canberra."
    },
    {
      "id": "A018",
      "name": "German Federal Academy for Security Policy",
      "country": "Germany",
      "continent": "Europe",
      "group": "A",
      "type": "Government security policy academy",
      "relevance": "A",
      "established": "—",
      "verification": "Verification pending",
      "has_website": true,
      "notes": "Berlin."
    },
    {
      "id": "A019",
      "name": "Italian National School of Government (SNA)",
      "country": "Italy",
      "continent": "Europe",
      "group": "A",
      "type": "Government administrative school",
      "relevance": "A",
      "established": "—",
      "verification": "Verification pending",
      "has_website": true,
      "notes": "Rome."
    },
    {
      "id": "A020",
      "name": "Turkish National Police Academy",
      "country": "Turkey",
      "continent": "Asia",
      "group": "A",
      "type": "Government police academy",
      "relevance": "A",
      "established": "—",
      "verification": "Verification pending",
      "has_website": true,
      "notes": "Ankara."
    },
    {
      "id": "A021",
      "name": "Royal College of Defence Studies",
      "country": "United Kingdom",
      "continent": "Europe",
      "group": "A",
      "type": "Government defense college",
      "relevance": "A",
      "established": "1927",
      "verification": "Verification pending",
      "has_website": true,
      "notes": "London."
    },
    {
      "id": "A022",
      "name": "Korea National Diplomatic Academy",
      "country": "South Korea",
      "continent": "Asia",
      "group": "A",
      "type": "Government diplomatic academy",
      "relevance": "A",
      "established": "—",
      "verification": "Verification pending",